,search_date,search_term,specified_search_location,job_url,job_title,company,location,description,salary,postcode
53,2020-02-09 13:50:55,research+scientist,Melbourne+VIC,https://au.indeed.com/rc/clk?jk=66f839e9ee1db390&fccid=875ac75dd66f4c49&vjs=3,Data Scientist / Machine Learning (blockchain),Crypto Recruit,Melbourne VIC,"Company: The company is a cutting edge cryptocurrency and blockchain technology company and are committed to transforming an entire industry.  They are an excellent team, fun, friendly and are now expanding and are keen to welcome new talent into their company.  This role is based in Sydney.  Responsibilities: Carry out independent research for forecasting Own research and experience is desirable, run experiments to explain and evaluate data sets and models and new features. Collaborate with our programmers to research models and pipeline into a production ready Saas Platform. You would use your machine learning experience so our own system can learn and clean the data itself. Happy to work with pools of raw data provided by our clients and customers. Work with other Data Experts and Engineers to develop our in-house data science library and pipeline. API told are essential and you will have a large amount of input from an early stage.  Requirements: A degree in related discipline e.g. mathematics, economics, computer science etc. Minimum 2 years commercial experience. Experience in applying statistical or machine learning approaches to data analysis Data mining and modelling experience using mainstream methodologies Outstanding communication skills both written and verbal are essential Must be able to work autonomously and be self-motivated Blockchain experience desirable but not necessary  Salary: $100-150k + equity/tokens - dependent on experience and negotiable.   Start date: As soon as possible.   To hear more about this role you can: Email - neil@cryptorecruit.com  Cryptorecruit are the worlds leading specialist recruiter for the blockchain/Cryptocurrency industry. We recruit positions from CEO, Frontend and Backend Blockchain developers to marketing and customer service roles. Please browse our website and at www.cryptorecruit.com and make sure to register your details.","$100,000 - $150,000 a year",
54,2020-02-09 13:50:56,research+scientist,Melbourne+VIC,https://au.indeed.com/rc/clk?jk=0c5322e5ff719749&fccid=dd616958bd9ddc12&vjs=3,"Senior Software Engineer, Cash App",Cash App,Melbourne VIC,"Company Description  Cash App is the fastest growing financial brand in the world. Built to take the pain out of peer-to-peer payments, Cash App has gone from a simple product with a single purpose to a dynamic money app with over 15 million active monthly users. Loved by customers and by pop culture, we’ve held the #1 spot in finance on the App Store for almost two years, and our social media posts see more engagement in a day than most financial brands see in a year. With major offices in San Francisco, New York, St. Louis, Portland, Kitchener-Waterloo, and Melbourne, Cash App is bringing a better way to send, spend, and save to anyone who has ever sought an alternative to today’s banking system.  Job Description  As a mobile-first financial solution, we’re building industry-changing tools to give our customers financial superpowers. As a Senior Software Engineer, you will be responsible for creating and improving Cash App product features and infrastructure. This includes expansion into new markets, scaling our infrastructure, growing our Cash Card program and building out our platform to enable our engineers, data scientists and customer support folk to operate more efficiently. You will: Work in a small, tight knit cross-functional team Have autonomy to research and achieve outcomes with support when you want it Support your colleagues when they want it Improving and expanding our applications and platforms Own features throughout their life cycle, from inception to supporting production Scale systems to a rapidly growing customer base of tens of millions Prioritise maintainable code and test all the things Draw many boxes with arrows on whiteboards  Qualifications  You have: Boundless curiosity Drive to find flaws in a system with many moving parts and take whatever steps are necessary to fix them Strong desire to perform and grow as an engineer Demonstrated technical initiative and leadership on previous projects Bachelor's Degree or Diploma in Computer Science, or equivalent experience Technologies we use and teach: Java, Kotlin Go Docker, Kubernetes Jaeger, Prometheus, SignalFx JUnit Hibernate, Vitess, Guice Additional Information  Cash App treats all employees and job applicants equally. Every decision is based on merit, qualifications, and talent. We do not discriminate on the basis of race, religion, color, national origin, gender, sexual orientation, age, marital status, veteran status, or disability status. We will consider for employment qualified applicants with criminal histories in a manner consistent with each office’s corresponding state and city guidelines",No salary found,
55,2020-02-09 13:50:57,research+scientist,Melbourne+VIC,https://au.indeed.com/rc/clk?jk=37d77f057e6f1918&fccid=feb484a8aef310be&vjs=3,MediaCom | Head of Strategy,MediaCom,Melbourne VIC,"MediaCom is an agency of GroupM, the world’s largest media investment company and are a part of WPP. In fact, we are responsible for one in every three ads you see globally. At GroupM APAC, our people are our strength, which is why fostering a culture of diversity and inclusion is important to us.  We are currently looking for a Head of Strategy to join us.  The role is both consultative, offering higher end, ‘up-stream’ strategic thinking to clients, as well as more ‘downstream’, predominantly reach-based channel planning, connecting deeply with the investment and content teams.  Purpose of Position The traditional approach doesn’t cut it for our Strategy and Planning team. We relentlessly seek to uncover a whole host of insights from culture, the economy, people, behavior and connections, and combine this with great platform and touchpoint understanding to both inspire custom media strategies. Our focus sits firmly within evidence based planning that translates to real business outcomes. A sound theoretical understanding of established marketing dogma, such as the EBI’s Laws of Growth is also paramount. Data is the driver. Delivering creativity is the goal. Our simple philosophy (Putting the “why” back in the business) keeps us grounded to make sure all strategic direction is clear and actionable.   The role is both consultative, offering higher end, ‘up-stream’ strategic thinking to clients, as well as more ‘downstream’, predominantly reach-based channel planning, connecting deeply with the investment and content teams.  You will also be conversant and have an expert understanding of MediaCom’s 20|20 ‘system-led’ planning framework and its application to strategic thinking. The ideal candidate knows how to covert analysis into real world solutions and have innovation in their blood. They simplify complexity to bring clarity of thought.   Reporting of the role This role reports to: Chief Strategy Officer and Managing Director  Key Relationships: The essential relationship is with Business Leadership. We’re not shying away from the fact that we are looking to emulate the tried and tested creative agency model, where the Strategic Planning Lead and Business Lead work as partners to deliver outstanding client service and outcomes. We aim to create a powerful duo in each of our agency verticals (e.g. Travel or FMCG) Senior clients: predominently Marketing and Brand Directors Agency partner strategic leads (eg. Creative, Shopper, Research) Internal department leads (Marketplace, MBA, Ecommerce, Data & Analytics) Key media and technology vendors, particularly their strategists. Academic partners (eg. Marketing scientists from Ehrenberg-Bass)  On any given day, you might Lead, manage and nuture a team of high performers Contribute to building and fostering strong client partnerships through deep understanding of the market they operate and the key business challenges that they face Proactively identify strategic opportunities, demonstrated through strong analytical and strategic skills to solve client challenges Lead the creation and ensure delivery on measurable client & strategy business KPIs Drive understanding, adoption and implementation of proprietary tools in the development of strategy across the agency Facilitate training and development that meet the needs (today and future) of the strategy community at Mediacom Collaborate across functions and specialisms to create a more integrated and end to end strategy and planning product Navigate and provide counsel on a variety of quant & qual research methodologies and how they should be integrated into the strategic planning process Facilitate both internal and external sessions with teams and clients to undercover new insight and create synergy between clients & experts in our team Create and deliver category, media and other relevant trends to both clients and internal teams Elevate reputation of Mediacom’s strategic offering through industry-related thought leadership panels, making best-in-class planning the norm and showcasing our work through awards programmes The ideal person A motivated and passionate media professional that strives to understand “why” Able to get things done, knows how to organize yourself and others Can strike up conversation with the clients and media and talk the talk Knows how to turn data and insights into a story Can see communications trends and solutions clearly Understand how tools and technology can help tell a story Keeps ahead of the industry news, knows what’s new and shiny in market A trusted advisor that can quickly understand the client’s business needs and develop a solution Loves to actively share POV on market and industry, both educating our clients and building trust You are a highly skilled communicator, that knows how to simplify the complicated media world and structure of an agency Is seen as a pivotal thought leader by clients when it comes to trading, contracts, vendors and delivering Numbers are a second language to you and you can translate between both fast, accurately and effectively.  You bring Broad, deep, and current knowledge of marketing, business strategy, and digital technology: 10+ years of relevant industry or professional services experience required The ability to work with data to develop insights and recommendations for clients A collaborative attitude and approach to solving problems A mastery of your strategic capability, and a basic understanding across other forms of strategy, including, but not limited to: Brand strategy, communications strategy, digital & media strategy A constant curiosity to challenge the status-quo  Core KPI's Lead a motivated strategic team within MediaCom, who are responsible for the strategic output of our client’s communications needs Coordinate and optimise annual strategic planning process Participate in marketing, new business pursuits and client workshops as directed (cross-GroupM, Partnership pursuits and any other unique or “first time” business development activities) Business development Awards – client based Industry opinion / Leadership Product definition and evolution Build strong relationships with key stakeholders – internal and external  About MediaCom Welcome innovators, initiative takers and instigators. We are 8,500 of the world’s leading media communications specialists, in 125 offices, across 100 countries. We have a global client roster that’s the envy of our peers. Adidas, Coca-Cola, Mars, P&G, PSA, Richemont, Shell and Sony to name but a few. We help brands unlock growth through media. We do this using our Systems Thinking approach to data, technology and creativity and design communication strategies that build brands and generate sales. We’re part of WPP, the world's largest marketing communications services group, which gives us access to the richest data sets and most robust benchmarks in the business. All this has helped us become the first network to hold the big six Media Network of the Year titles concurrently. But the real secret to our success is simple (and not really a secret). It’s our People First, Better Results philosophy. We know that when we invest in our people, we’ll deliver better results not only for them, but also for our clients. We also know that talent comes in all shapes, sizes, genders and ethnicities. That’s why our agencies are open environments that celebrate difference. Do you want to work with smart, creative, enthusiastic people? So do we. Welcome to MediaCom For more information, visit www.mediacom.com Find us on Twitter @mediacomglobal Like us on Facebook at facebook.com/MediaComGlobalNews Join us on LinkedIn at linkedin.com/company/mediacom  About Australia GroupM Australia takes pride in being a group built on a set of core values that extend to every aspect of our operation. We are committed to providing an empowering workplace that offers opportunities to learn, succeed and grow. We do this through our dedicated in-house training team who tailor our programs for every level of employee in every discipline across the group. GroupM is the largest media investment management company in Australia with 30% market share and over 800 employees. With such a unique culture, GroupM embraces workplace diversity, allowing our employees to bring different ideas and solutions to the workplace.",No salary found,
56,2020-02-09 13:50:59,research+scientist,Melbourne+VIC,https://au.indeed.com/rc/clk?jk=ca92ba727462de4f&fccid=606c5c0721b4933c&vjs=3,"Engineers, Scientists and Transport Professionals - Melbourne",ARRB Group,Port Melbourne VIC 3207,"The time is now to be part of Australia's integrated mobility future Join ARRB: Inspiring, Connecting, Delivering and Shaping our Transport Future Opportunities Available Nationally   About Us We’ve been doing it since 1960! The Australian Road Research Board (ARRB) is the source of independent expert transport knowledge, with 60 years of experience focused on delivering a connected and adaptable future for Australia and New Zealand. ARRB has a strong heritage supporting and delivering high quality applied research for Australian and New Zealand state road agencies, local and federal government and for the community. Our teams are made up of world-leading roads, transport and infrastructure professionals who analyse and interpret global research and apply it to the Australian and New Zealand context.  Our Mission: Creating knowledge for tomorrow’s transport challenges and solutions for today. Our Values: Integrity, Transformative, Collaborative and Energy and Passion Our Vision: To help make the world’s cities smarter, cleaner, greener, safer, more efficient and productive through intelligent transport solutions.  Why join ARRB: ARRB is a dynamic and vibrant organisation providing exciting opportunities for people to do great things, to tackle the big infrastructure questions, and to see these solutions being practically applied.  Our staff operate within a state-of-the-art workplace with multi-disciplinary teams with highly evolved skills. At ARRB, the National Transport Research Organisation, innovation, personal and professional development and global connectivity is fostered and nurtured - enabling true collaboration.  Our world-class experts are working on extraordinary challenges to provide solutions to the transport industry challenges across Australia and globally. ARRB continues to evolve and places a great emphasis on building our capacity in fields of critical importance to the road and transport industry.  As a result of ARRB’s great success, there has been an overwhelming response to utilise our technical expertise from our local, state and federal governments both here and in New Zealand. ARRB are looking for dynamic and passionate professionals to join the team. If you are looking for a change and want to be part of a great team, the time is now!  Be inspired and become part of an incredible journey, to shape our transport future for all Australians.  We Seek Individuals who are: The best of the best: Technical professionals with a network nationally and/or globally Creative and innovative individuals who not only ask questions but provide solutions Highly motivated people who enjoy going the extra mile and thrive in team environments Passionate, high performing, innovative people with ideas and are excited to drive change Eminent within their field of expertise, with highly developed and demonstrable capabilities Discipline Areas: Road Pavements and Bridge Structures Sustainability and Resilience Transport Safety Intelligent Transport Systems Asset Management Data Collection and Analysis What we offer:  An exciting, dynamic and collaborative workplace with challenging roles, where your skills, knowledge and experience will be recognised and respected, including: Opportunities to contribute to high-profile and interesting projects that make a difference to the profession and the community. Opportunities to work collaboratively on local, state and national projects with a network of experts and colleagues around the country. Healthy work-life balance, with flexible arrangements Strong support for career development and further study A competitive salary & staff benefits Free electric vehicle chargers Range of professional development options Social club activities We embrace diversity – with a multidisciplinary staff from all over the world operating in offices across Australia; Brisbane, Sydney, Melbourne, Adelaide and Perth Access to paid parental leave Potential salary packaging benefits available State-of-the-art work environment To be considered: Applicants must be Australian Citizens / Permanent Residents Press the ""APPLY"" button in this job advertisement to apply. Alternatively, for a confidential conversation, please contact Human Resources, 03 9881 1555. Please ensure you have attached your CV, Cover Letter and answer the screening questions provided. Clearly indicate on your Cover Letter for which Discipline Area and State you are applying for.",No salary found,3207
57,2020-02-09 13:51:02,research+scientist,Melbourne+VIC,https://au.indeed.com/rc/clk?jk=5736f0e97ab57566&fccid=3444e7c94299ba32&vjs=3,Account Manager Core,NOKIA,Melbourne VIC,"Nokia is a global leader in the technologies that connect people and things. With state-of-the-art software, hardware and services for any type of network, Nokia is uniquely positioned to help communication service providers, governments, and large enterprises deliver on the promise of 5G, the Cloud and the Internet of Things. Serving customers in over 100 countries, our research scientists and engineers continue to invent and accelerate new technologies that will increasingly transform the way people and things communicate and connect. The Nokia Software (NSW) Global Business Center team is seeking a strategic software sales professional to develop NOKIA’s Software Core business in Australia based out of Melbourne. The sales account manager is responsible for the account strategy, sales coverage plan, account plans and sales execution to meet or exceed our growth plan from these key accounts. The position has the following core responsibilities: Develop strategy, tactics and sales plans for key accounts. Continuously generate strong pipeline that supports the achievement of assigned quota(s). Develop C-suite relationships with these key customers and partners. Understand customer business paint points and KPI’s that are established to meet their business objectives. Identify and qualify new business opportunities in meeting with C-Suite key decision makers to obtain executive sponsorship in pursuit of the sale. Position the NOKIA NSW value proposition, demonstrating business benefits and ROI differentiating NOKIA from its competitors. Achieve and strive to exceed assigned quota(s) by directly covering these key accounts. Introduce appropriate senior NOKIA management resources in pursuit of orders/sales opportunities. Partner with the broader NOKIA sales team to leverage joint solutioning and sales. Work with alliance partners to extend our sales efforts in the accounts. Strictly adhere to the published NOKIA SELL & NSW processes. Complete all administrative assignments comprehensively and on-time. Represent NOKIA in a professional and an ethical manner. Travel to make sales calls and related business activities can be up to 3 to 4 days a week in assigned territory. Key experience and skills required:  At least 8 years of proven sales experience in a network software technology company selling to the Communications industry service providers in Australia. Understand Communications software, with prior employment history in this space selling Core solutions and other related software. Ability to build C-Suite relationships directly with the CSPs. Solid business acumen understanding the complexities of business and customer needs. Ability to understand at a high level the technical value proposition and then translate it into a business value position (i.e. consultative sales approach for selling solutions). Ability to bring various teams together and lead a sales campaign. Ability to work/develop the partner ecosystem to enable a stronger go-to-market approach to increase market coverage. Demonstrate ability to close large and complex deals >1Me. Excellent communication, interpersonal and presentation skills. Creative ‘out of the box’ thinker. Exceptional work ethic, the ability to work independently, self-motivated, driven and a strong desire to succeed.",No salary found,
