,search_date,search_term,specified_search_location,job_url,job_title,company,location,description,salary,postcode
148,2020-02-09 13:53:36,data+scientist,Melbourne+VIC,https://au.indeed.com/rc/clk?jk=1fee282edc682978&fccid=66a7a8d8b5189b35&vjs=3,Sr. Solutions Architect,Kinetica DB,Melbourne VIC,"Company Description  The Kinetica Active Analytics Platform combines streaming and historical data with location intelligence and machine learning-powered analytics. Organizations across automotive, energy, telecommunications, retail, healthcare, financial services, and beyond leverage the platform’s GPU-accelerated computing power to build custom analytical applications that deliver immediate, dynamic insight. Kinetica has a rich partner ecosystem, including NVIDIA, Dell, HP, and IBM, and is privately held, backed by leading global venture capital firms Canvas Ventures, Citi Ventures, GreatPoint Ventures, and Meritech Capital Partners. For more information and trial downloads, visit kinetica.com or follow us on LinkedIn and Twitter.  Job Description  Kinetica Active Analytics brings together all key elements of active analytics in a unified platform: historical data analytics, streaming data analytics, location intelligence, and artificial intelligence. The Kinetica Active Analytics Platform is cloud-ready and dramatically simplifies the typical architecture for smart applications, with unmatched performance. Kinetica is seeking customer-facing, solutions-oriented technical professional to join our Professional Services team. The professional we seek loves designing user experiences for complex technical products, thrive in an entrepreneurial environment, and share our drive to craft products that customers will enjoy. Are you a solutions-oriented technical professional who is looking for an opportunity to make an impact? Do you naturally go the extra mile to design brilliant experiences despite highly technical inner workings? Do you believe that success is both a personal and a team effort; and that winning technical products are the same? And that they are complex but well-integrated machines that used best available technologies packed into a cohesive product experience that functions at scale? Are you a software engineer at heart, or a data scientist who can collaborate across the various ecosystems to drive a product to the finish line? Responsibilities Partner with customers and consult them in developing a solution for a new proof-of-concept within the logistics industry. Collaborate with a team of talented engineers to analyze, model, and ultimately provide the insight and results from big data and machine learning that will enable a solution. Keep attuned to customer use and actively work to improve product experience to meet usage, both current and future usage the customer may not even realize they need  Qualifications  BS/MS/Ph.D. in Computer Science, Data Science, Operations Research, Statistics, Math, Physics, or equivalent Excellent communication (presentation, conversation, and writing) skills Enthusiasm for technology and product development Experience in Machine Learning and Data Science Understanding of the data science ecosystem - commercial and open source Experience with Big Data sets Proficiency working in Linux environments Comfortable with Python and other languages Experience with at least one machine learning open-source package (sklearn, TensorFlow, Caffe2, PyTorch, etc.) Willingness to travel Preferred Qualifications 3 to 5 years of current experience at a tech startup, technology/data science consultancy with data science tools and DevOps tools Strong customer-facing communications skills as demonstrated by personal projects, technical blog postings, volunteer activities, etc. Experience with geospatial data Experience with distributed systems Experience working with highly complex technical ecosystems (resource managers, containers, automated testing - e.g., Mesos, Kubernetes, Docker) Experience working in a highly automated environment for correctness and consistency (automated builds, continuous integration, automated testing, containers - e.g, Git, Jenkins) Experience working with computational systems (e.g., NumPy, Pandas, Spark, etc.) Location: Australia Additional Information  All your information will be kept confidential according to EEO guidelines.",No salary found,
149,2020-02-09 13:53:38,data+scientist,Melbourne+VIC,https://au.indeed.com/rc/clk?jk=c57c25d44db9159f&fccid=e3775ab426a075cd&vjs=3,Business Analyst - Data Analytics,Greythorn,Melbourne VIC,"Business Analyst - Data Analytics Utilities industry Melbourne CBD  Business Analyst - Data Analytics Projects Assist Project Delivery Immediate start  Are you a Business Analyst with 2 plus years of utilities experience?  Do you have end to end data analytics project experience?  Are you a strong communicator and able to work with end user clients?  If the answer is yes, then please read further..  Business Analyst - Data Analytics  Our client is a community of 1,200+ passionate individuals dedicated to innovation, new technologies, data and digital transformation projects. They are in 11 different countries, our footprint covers France, Singapore, Hong Kong, Vietnam, Luxembourg, Belgium, Madagascar, Morocco, US, Canada and Australia. Our expertise consists of 18 years of market knowledge into the business organization, digital practices, agile, data management and innovation.  Their Australian operations are growing rapidly, and they are partnering with local blue-chip and multinational companies on truly transformational engagements  About the Opportunity:  We are looking for an experienced Business Analyst to work with a team of data scientists and data analytics practitioners to manage the project delivery.  You'll need to have at least three to five years' corporate experience as a business analyst with experience in data analytics project. You should have excellent communication and business data analysis skills. Should be able to demonstrate successful implementation of complex projects within stringent timelines.  Responsibilities:  Guide and support the team on to deliver data analytics projects Design and manage business requirement gathering, testing, review and sign-off process Navigate project blockers to ensure the team delivers the project outcome Report and maintain documentation related to project artefacts Build strong relationships with data analytics practitioners in the project team  Qualifications:  At least 3 - 5 years' of experience in a similar Business Analyst role Experience in data analytics project is a MUST have High attention to detail Experience in Agile methodologies and using JIRA/Confluence tools Excellent communication and stakeholder management skills Advanced proficiency with excel for data analysis (SQL is a plus)  Why join?  Being part of our Data & Analytics community means that we will gather quite often.  The key elements of our community are:  Quarterly dedicated time to co-create the future of work/the future of Maltem and our practice(s) You will have the opportunity to have a mentor in this adventure You'll have the opportunity to co-create meet-ups / events We will invest in your training with the willingness of empowering our community A huge yearly gathering event A daily group to share and stay in touch  We are looking to go beyond expectations and shape the future of work by working with passionate, skilled and energetic people both in support and delivery side. To learn more, contact Mark Watson at Greythorn, Melbourne or apply now!   Mark Watson  Senior Consultant Let's Connect  Https://www.linkedin.com/in/markwatson5/  +61 3 8633 4129  By submitting your resume and other personal information with this application you are consenting to this information being collected in line with our privacy policy. Follow the link to learn more - www.greythorn.com.au/privacy-policy  State: QLD, licensee/s Manpower Services (Australia) Pty Ltd, LHL-02026-D5L4Q. State: QLD, licensee/s Greythorn Pty Ltd, LHL-02014-Y5F6D. State: SA, licensee/s Manpower Services (Australia) Pty Ltd, LHS 288856, State: SA, licensee/s Greythorn Pty Ltd, LHS 288821. For queries relating to 'Labour Hire Licences' ONLY please contact: 'labour.hire.licensing.enquiries@au.manpowergroup.com' (do not apply to the advert using this email). BBBH104367_158105163096148","Temporary, Contract",
150,2020-02-09 13:53:39,data+scientist,Melbourne+VIC,https://au.indeed.com/rc/clk?jk=0d0fb535e5897cc4&fccid=208733e6407dd389&vjs=3,Clinical Trials Research Midwife,Mercy Health,Heidelberg VIC,"Are you an experienced midwife interested in research? Are you looking to diversify your professional portfolio and engage in work to improve patient outcomes?  We are currently recruiting two midwifes to join the Mercy Perinatal and University of Melbourne O&G research team to be a part of the BUMPS study. The study is aims to develop a novel blood test to help women avoid the devastation of a stillbirth.  We are a close-knit, dedicated and friendly team of clinicians, scientists and researchers based in the newly renovated University of Melbourne department. This role also presents the opportunity to engage with the laboratory and learn database management skills, while still engaging with patients on regular basis. As part of this role you may also learn novel skills in measuring the percentage body fat of newborns using a PEAPOD machine.  2 x Part-Time positions (5 hours per day, 5 days per week (0900-1400)), fixed-term for 12 months (with the possibility of contract extension by mutual agreement thereafter) Grade 3B positions, Monday-Friday roster, excluding nights and Public Holidays Manage day-to-day operations (participant screening, recruitment, PeaPod measurements, engagement, follow-up assessments, documentation, record keeping, etc.) of a research study Maintain accurate participant records, including data entry  ABOUT YOU:  Registered midwife (+/- nurse) with current APRHA registration and a minimum of 2 years postgraduate midwifery experience (essential) Current Good Clinical Practice (GCP) certification or commitment to attainment within three months of commencing role (essential) Have completed or currently undertaking postgraduate study (desirable) Excellent organisational and team working skills, with the ability to work independently (essential) Highly developed computer skills, including familiarity with Microsoft Office Suite (Word, Excel & Outlook: essential) as well as with REDCap database (desirable)  ABOUT US:  Mercy Health is a Catholic organisation grounded in a 2,000-year tradition of caring for others. Founded by the Sisters of Mercy, Mercy Health is made up of more than 9,500 people who provide acute and subacute hospital care, aged care, mental health programs, maternity and specialist women’s health services, early parenting services, home care services and health worker training and development.  Mercy Health is proud to be recognised as an Employer of Choice for Gender Equality by the WGEA.  WHAT WE OFFER:  Mercy Health recognises that many people want to work somewhere that is more than ‘just a job.’ At Mercy Health, we pride ourselves on our values-based culture, and offer a generous range of benefits to support you to maintain a healthy work/life balance. These include:  Salary packaging benefits Opportunity to purchase additional leave Health and Wellbeing programs Camp Australia School Holiday Program Career progression and development opportunities A range of discounts available across a diverse portfolio of financial, healthcare, travel and other services  We focus on caring for our staff members and those important to them. We support all staff to be their authentic selves at work through Whole Self @ Mercy Health - our network group for LGBTIQ staff and allies.  At Mercy Health we pride ourselves on embracing diversity and foster an inclusive culture where individual differences are respected and celebrated. We encourage applications from people of all ages, abilities and cultural backgrounds including Aboriginal and/or Torres Strait Islander Peoples.  To be the successful candidate you must meet the position requirements as well as provide a current Police Record Check.",Part-time,
151,2020-02-09 13:53:39,data+scientist,Melbourne+VIC,https://au.indeed.com/rc/clk?jk=b577ff1f484bfd94&fccid=8e3646ac1455f033&vjs=3,AB Testing/Experimentation Specialist,Sportsbet.com.au,Melbourne VIC,"Work type: Full time  Location: Melbourne  Categories: Testing, User Experience  Experience at designing, deriving true insights from AB testing and multi variate digital experiments  Passionate about understanding customer behaviour  Passionate about delivering the best possible experience to our customers  Who are we?  At Sportsbet we love different. Whether you love to rock your activewear or jeans and a tee, we like to focus on what you’re great at and how you’re going to make our team even better. With over 7000+ globally cool, clever and curious people around the world, we’re a global player, but in Melbourne/Sydney/Darwin we’re tight knit with 700 of us bringing excitement to life everyday locally.  Sportsbet’s commitment to responsible gambling is genuine and demonstrated through the wide range of responsible gambling initiatives and tools we offer that go over and above industry requirements. We care about our team members and customers and everyone at Sportsbet has a role to play in bringing our commitment to Responsible Gambling to life. Check out the tools and information we provide our customers to help manage their gambling on our dedicated site at https://responsiblegambling.sportsbet.com.au/hc/en-us  What are the perks?  Best in class Parental Leave program with six months paid leave for Primary Carers  Tailored career development programs, as well as a commitment to developing Thought Leader and Specialist Talent programs  Discounted Myki & gym memberships, free breakfast and loads of event and conference tickets and many more  Who are the team?  This role will be a key member of the Data Products team that includes Data Scientists and Enablement Managers that build the models that underpin many of the cool experiences that Sportsbet provides for our customers.  What is the job?  The AB Testing/Experimentation Specialist can expect to work on the cutting edge of technology, big, very-big, and not-so-big data, algorithmic decision-making – all while driving change at a fast-paced, rapid growth tech company.  Some of your responsibilities include but not limited to;  Work with senior decision makers to help inform digital customer experience decisions  Work back into the Data Science teams with strong in-market insights that help them to improve and iterate their models  Define appropriate metrics of success for all experiments  Evaluating risks and trade-offs associated with each course of action  Working closely with users to ensure all projects meet business needs  IS THIS ROLE FOR ME?  This role requires strong communication skills with a range of different stakeholders both commercial and technical. It requires a self-starter who can see all the angles and can see what needs to be done rather than sitting back and waiting to be told;  You will understand various ecommerce metrics  Base level understanding of data science  Very strong analytical skills  Strong communication skills with a range of different stakeholders both commercial and technical.  Proven ability to leverage analytics and quantitative methods to inform and influence decision-making, with SQL / data mining skills and experience  Experience implementing innovative ideas or products in complex organization  Experience working in a fast-paced and high growth environment  We’re a flexible, progressive, open-minded, and inclusive employer who welcomes you for who you as you are. To make sure you are the best person for Sportsbet we assess behaviours, learning agility and expertise. This ensures all types of experiences can be considered for all roles. We encourage you to apply immediately as we will begin shortlisting within 1-2 weeks of advertising At Sportsbet.",No salary found,
152,2020-02-09 13:53:43,data+scientist,Melbourne+VIC,https://au.indeed.com/rc/clk?jk=758f1ee2d17b5569&fccid=4cddfb241cb472e6&vjs=3,POSTDOCTORAL FELLOW,University of Melbourne,Parkville VIC,"Job no: 0049987  Work type: Fixed Term  Location: Parkville  Division/Faculty: Faculty of Business and Economics  Department/School: Department of Management and Marketing  Salary: $102,967 - $122,268 (Level B)  Role & Superannuation rate: Academic - Full time - 9.5% super  We currently have an opportunity for an early-career postdoctoral academic to join our team of organization scientists, computer scientists, and mathematical biologists as part of a project funded by the Australian Research Council to implement parallel processing (on GPGPUs) and distributed computing methods (on cloud-based platforms) to study complex dynamic social and health systems. Formally employed on a two-year contract (with the possibility of extension conditional on funding) in the Department of Management and Marketing within the Faculty of Business and Economics at the University of Melbourne, the successful candidate will share responsibility for coding existing and new algorithms that characterize and test causality using methods from dynamical systems research in ecology and applied physics. In conjunction with Associate Professor Michael Zyphur (University of Melbourne), Associate Professor Jinjing Li (University of Canberra), and Professor George Sugihara (University of California, San Diego), this two-year position will give the incumbent an opportunity to learn and apply new skills to help revolutionize data analysis in the social and health sciences. Throughout the year some travel to Canberra is expected, and the Postdoctoral Fellow may even choose to be primarily located in Canberra to more closely collaborate with Associate Professor Jinjing Li if this is of interest.  The successful candidate will have a PhD in Computer Science or equivalent, with data science and/or software engineering expertise using Python and C. Experience with package development in R may be helpful but is not necessary. The project will primarily focus on scientific computing applications to evaluate complex dynamic systems on GPUs and massively distributed CPUs (e.g., AWS platforms such as Lambda or equivalent). For the GPU case, programming in the novel and intuitive ArrayFire library will allow compiling for CUDA and OpenCL (as well as Python/C for local parallel processing on multi-core CPUs). For distributed computing on cloud infrastructure, in-house development using Python and C will be required. We do not expect prior expertise in all APIs / languages that will be used for the project, but we do expect the qualified candidate to have a strong interest in learning and using the required APIs / languages as needed as well as the background required to do so.  Salary is generous at Level B (over $100k per annum) and generous discretionary spending for national and international conferences as well as hardware (including cloud computing time). With a focus on passion and innovation rather than typical forms of “office work”, the appointee will work alongside other programming experts and applied researchers seeking to revolutionize data analysis in the social and health sciences. Prospects for employment in academia and applied industries after the two-year Postdoctoral position are expected to be substantial.  Advertised: 24 Jan 2020 12:00 AM AUS Eastern Daylight Time  Applications close: 25 Feb 2020 11:55 PM AUS Eastern Daylight Time","$102,967 - $122,268 a year",
153,2020-02-09 13:53:44,data+scientist,Melbourne+VIC,https://au.indeed.com/rc/clk?jk=5f1ddb7886563091&fccid=db092f8b7448d6e5&vjs=3,Data Engineer,Quantexa,Melbourne VIC,"We are looking for individuals with a proven track record in big data projects. A background in AML, KYC, screening, regulatory compliance or fraud is highly advantageous, especially for more senior roles. In this role you will: Work with clients to solve business problems in the area of fraud, compliance and financial crime: Manage, transform and cleanse high volume data; Write defensive, fault tolerant and efficient code for data processing; Automate data processing to enable on-going alerts on high risk activity; Present project results to clients; Work very closely with data scientists to ensure efficient and effective delivery of solutions; Use leading open source big-data tools, such as Spark, Hadoop, Scala and Elasticsearch. You should be comfortable with working with high profile clients, on their sites; Work with our expert software development team to produce reusable applications; Use emerging and open source technologies such as Spark, Hadoop, and Scala; Collaborate on scalability issues involving access to massive amounts of data and information; Take on ad-hoc tasks as required for the running of a small, yet rapidly expanding business. For senior roles in addition you should be comfortable: Working with clients to Elicit and document solution requirements; Assuring high quality implementation of solutions; Providing technical vision for, managing and developing teams to deliver Quantexa's software to clients. Requirements Candidates must have the following: Experience working on big data project implementations; Excellent technical skills including expert knowledge of at least one big data technology such as Spark, Hadoop, or Elasticsearch; Experience of building data processing pipelines for use in production “hands off” batch systems, including either (or preferably both) traditional ETL pipelines and/or analytics pipelines; Strong coding experience in the likes of Scala or Java; Client facing experience, good communication and presentation skills; Academic qualifications in computer science, physics, mathematics or similar degree (Credit or above) or equivalent; Enthusiasm to learn and develop emerging technologies and techniques; Exhibit strong technical communication skills with demonstrable experience of working in rapidly changing client environments; Demonstrate strong analytical and problem-solving skills and the ability to debug and solve technical challenges with sometimes unfamiliar technologies; Ideal candidates will also: Have worked on a variety of complex data orientated projects for financial services clients; Have a good understanding of computer science and preferable come from a software engineering background or other scientific degree incorporating IT modules (e.g. Maths/Physics); Have exposure to Agile, especially SCRUM; Be open to short-medium term international travel; Arrive with experience at working with a variety of modern development tooling (e.g. Git, Gradle, Jenkins, Nexus) as well as technologies supporting automation and DevOps (e.g. Ansible, Chef, Puppet, Docker and a little bit of good old Bash scripting); Have an excellent appreciation of what makes a high quality, operationally stable system and how to streamline all areas of development, release and operations to achieve this Benefits Competeitve Salary Company Bonus Supperannuation of 9.5% Huge opportunities due to scale of growth Unlimited access to technical library",No salary found,
