,search_date,search_term,specified_search_location,job_url,job_title,company,location,description,salary,postcode
96,2020-02-09 13:52:06,data+scientist,Melbourne+VIC,https://au.indeed.com/rc/clk?jk=366a38c51078419e&fccid=3a908277da64a94a&vjs=3,Data Scientist,Australia Wide Personnel Group,Melbourne VIC,"The Company  This is an Australian company. They have developed and now produce a high tech, next generation biomedical device utilised worldwide. They continue to develop enhancements and new applications, with an emphasis on delivering world class standard of service and performance to their customers.  The Job  It will focus on using data for predictive modelling and statistical analysis. You should note that this is not a ""big data"" or ""data mining"" role. You will be expected to work with machine learning and linear regression techniques, and problem solve by means of predictive modelling in conjunction with other Scientists and Engineers. The data will be essentially ""time series biological data"". The ideal candidate should have Amazon SageMaker (machine-learning platform) experience with signal processing/neurophysiology background.  You  You are degree qualified (Bachelor's or Master's or doctorate) in Statistics or Data/Computer Science and have applied your expertise in a commercial capacity for at least a few years. You need to have a working knowledge of R and Python. You will be able to explain very effectively what sets you apart from others who claim similar skills, and why this position appeals to you.  You must be either an Australian Citizen or a holder of an Australian Permanent Residency Visa to be eligible to apply for this position. 3097043 KB","$100,000 - $120,000 a year",
97,2020-02-09 13:52:07,data+scientist,Melbourne+VIC,https://au.indeed.com/rc/clk?jk=c4c7d302aa742868&fccid=3c9bc1385272ea26&vjs=3,Data Scientist,FourQuarters,Melbourne VIC,"Exciting opportunity to work with vast amounts of complex health data Must have strong statistical analysis background Experience working with health-related data would be hugely beneficial   Data Scientist required to provide statistical analysis around health data for a leading technology business.  Responsibilities: exploring internal and 3rd party data, improving data collection approaches data mining using innovative techniques building and optimising classifiers using machine learning methods carrying out analysis and presenting insights and findings in an outcome-focused manner Requirements: experience using machine learning techniques and developing algorithms extensive statistical analysis background, including regression testing, distributions etc with some experience working on health-related data solid Python skills Click on the 'Apply' button or call Sabina Ahuja on (03)99828478","$125,000 a year",
98,2020-02-09 13:52:08,data+scientist,Melbourne+VIC,https://au.indeed.com/rc/clk?jk=f7e26fa551b25f4a&fccid=bafa4b35e9cd20ce&vjs=3,Environmental Scientist – Contamination Assessment and Remediation,AECOM,Melbourne VIC,"The infrastructure pipeline in south eastern Australia continues to grow, and AECOM is playing an influential role in the development and delivery of many of these key infrastructure programs and projects. This includes projects in the rail, roads, aviation, urban development, renewable energy and defence markets.  Our environment team helps private and public sector clients in Australia and around the world deliver for their stakeholders while achieving compliance, promoting resilience and reducing, or eliminating, impacts and risks to our communities and our natural environment  Job Details  Reporting to the Workgroup Manager - Geosciences and Remediation Services, you will task manage and contribute to contamination assessments and remediation projects of varying size and complexity. Your role will focus on assisting delivery of contamination management and assessment work packages within city-shaping infrastructure projects, with the flexibility to contribute to assessment and remediation projects in other sectors as required. With an uncompromising commitment to health and safety, client service and technical excellence, you will be an experienced environmental engineer or scientist, at ease in a dynamic work environment, preparing reports, leading field work teams, liaising with subcontractors, communicating with clients and project stakeholders, planning and preparing work scopes and promoting innovative solutions for your clients. You could be working on:  + Preliminary and Detailed Site Investigations  + Remedial Action Plans  + Site Validation Reports  + Waste Classifications  + Site supervision and contractor management.  Minimum Requirements  + Previous experience in a consultancy environment, specifically contaminated land assessment and remediation  + Technically strong in preliminary and detailed site investigations for soil, vapour, and groundwater  + Experience in data management software (ESDAT / Equis) and preparation of environmental reports  + H&S training including: First Aid, Construction Induction (White Card), and preferably 24 or 40 hr HAZWOPER.  Preferred Qualifications  + Bachelor’s degree in an appropriate discipline such as environmental science, engineering, geology, or earth science.  What We Offer  When you join AECOM, you become part of a company that is  pioneering the future . Our teams around the world are involved in some of the most cutting-edge and innovative projects and programs of our time, addressing the big challenges of today and shaping the built environment for generations to come. We ensure a workplace that encourages growth, flexibility and creativity, as well as a company culture that champions  inclusion, diversity and overall  employee well-being through programs supported by company leadership. Our  core values define who we are, how we act and what we aspire to, which comes down to not only  delivering a better world , but working to “make amazing happen” in each neighborhood, community and city we touch. As an Equal Opportunity Employer, we believe in each person’s potential, and we’ll help you reach yours.",No salary found,
99,2020-02-09 13:52:11,data+scientist,Melbourne+VIC,https://au.indeed.com/rc/clk?jk=2d0c155fd069e123&fccid=de71a49b535e21cb&vjs=3,IBM Research Scientist – Blockchain Postdoc FTH 24Months Melbourne,IBM,Melbourne VIC 3001,"Introduction IBM Research Scientist – Blockchain Postdoc FTH 24Months Melbourne  Melbourne Based24 Month Fixed Term HireCompensation package from $89,250 (full-time equivalent inclusive of superannuation) and will be determined based on successful candidates’ relevant skills and experience.  Your Role and Responsibilities Candidates will be joining a team of researchers and software engineers to conceive, build, test and deploy solutions for some of the world’s challenging technology problems. You will be working under the direction of senior IBM research scientists globally and will be expected to publish at high quality academic conferences and journals as well as relevant industry venues.  Ideal candidates will have expertise in several of the following areas: A solid understanding of state-of-the-art research in the field of distributed systems. Expertise in designing, developing, and evaluating distributed systems middleware. A solid background in programming and exposure to end-to-end software development practices.  Required Experience: A recent PhD in Computer Science or related field. Worked on one or more projects that involved the application of principles in distributed systems in areas relating (but not limited) to distributed databases and file/storage systems, distributed protocols, peer-to-peer systems, fault-tolerant and highly available systems, and scalable operating systems. Designed, developed, and evaluated methods and algorithms for solving distributed systems problems. Expertise in one or more programming languages, and a strong background in data structures and algorithms. Exposure to Distributed Ledger Technologies will be viewed very positively. Exposure to Cryptography, Game Theory and Mechanism Design will be viewed very positively. Experience working in teams and have applied well-known end-to-end software development practices.    Required Professional and Technical Expertise As above   Preferred Professional and Technical Expertise As above  About Business Unit With more than 3,000 researchers in 12 labs located across six continents, IBM Research brings together hundreds of researchers who possess unparalleled industry expertise to address some of the world's most challenging problems. Join us as we do pioneering work in areas such as cognitive computing, augmented intelligence, quantum computing, and blockchain, to name a few.  Your Life @ IBM From landing the first astronauts on the moon to building the first cognitive system to win Jeopardy! IBM with its diverse culture, continues to be the innovative spark of the computing revolutions that shape our world. At the core of IBM’s innovation are its 12 global research labs. IBM Research Australia is a young, proud and diverse community working on industry solutions, conceiving, designing and building next generation enterprise systems.  About IBM IBM Research Australia is looking for a Postdoctoral Researcher to join our Blockchain Platforms team. This team is working on challenging long-term problems in the areas of Blockchain interoperability, scalability, value networks and governance, while also working with enterprise clients to realise the value of blockchain systems today.  Location Statement For additional information about location requirements, please discuss with the recruiter following submission of your application.  Being You @ IBM IBM is committed to creating a diverse environment and is proud to be an equal opportunity employer. All qualified applicants will receive consideration for employment without regard to race, color, religion, gender, gender identity or expression, sexual orientation, national origin, genetics, disability, age, or veteran status. IBM is also committed to compliance with all fair employment practices regarding citizenship and immigration status.","$89,250 a year",3001
100,2020-02-09 13:52:12,data+scientist,Melbourne+VIC,https://au.indeed.com/rc/clk?jk=080a1cf971b85e3f&fccid=9d2b9604022d7bef&vjs=3,Data Engineer,Aurecon Group,Melbourne VIC,"Just imagine your future with us… At Aurecon we see the future through a very different lens. Do you? Innovation, eminence and digital are at the heart of everything we do. Are you excited about the future? Are you driven by the opportunity to work on some of the most challenging and complex projects around the world and to learn from the best? We are. Diversity is at the core of everything we do. We work together to create a culture based on respect, trust and inclusiveness. Our differences are what fuel our creativity. We embrace flexible working and are always open to discussing your individual needs so that you get to create your own experience with us. What will you do? As Data Engineer you will be joining a rapidly growing team in an emerging unit of the business where your expertise will lend value to our developing client offering. Your knowledge will give you the confidence to work closely with clients from an array of public and private sector environments as well as work collaboratively in a multidisciplinary environment day to day. Advise clients on managing their data Create accessible data pipelines for consumption by data scientists Manage the mechanics of data ingestion, processing and storage Acquire and integrate data from various sources Create and manage databases, data lakes and data warehouses used for analysis by data scientists Write queries and run ETL process as required to make data easily accessible in the required format Design and implement the technical infrastructure required to maintain databases and production processes  We know the work we do is vital in assisting our world’s economic development and, it’s the technical expertise and the depth of knowledge of our people that really sets us apart. Here are the key things you will need to ‘bring ideas to life’. Expertise in data strategy and data / systems architecture Expertise in acquiring, integrating and manipulating different types of batch and streaming data from a range of different sources Experience in working with relational and non-relational databases, and big data tools and platforms like Hadoop, Spark, AWS, Azure and GCP Working knowledge of programming languages such as Python, Java and C Broad familiarity with data modelling, machine learning tools and data visualisation tools and methods We know today’s complex challenges can only be solved through bringing together diverse teams of people from across our business, so there will be opportunities for you to apply your skills and creativity to projects in other geographies and markets. What can you bring to the team? Firstly, you will share our genuine passion for re-imagining engineering and be someone that actively pursues continuous learning to help shape the future. You will also have a fantastic work ethic and previous experience working with senior leaders in a professional services environment. In addition to your strong communication skills, you should also be comfortable working with a diverse range of stakeholders at all levels of the business. Our Aurecon Attributes describe the types of people we bring together for clients. We don’t expect you to have all eight of the attributes, but one that is unique to you. Finally, we value that each of our team members brings something different to Aurecon. We look for people who have had a broad range of experiences throughout their career and can demonstrate how they have worked as part of a team to bring ideas to life. Does that sound like you? About us We’ve re-imagined engineering. Aurecon is an engineering and infrastructure advisory company, but not as you know it! For a start, our clients’ ideas drive what we do. Drawing on our deep pool of expertise, we co-create innovative solutions with our clients to some of the world’s most complex challenges. And through a range of unique creative processes and skills, we work to re-imagine, shape and design a better future. We listen deeply and intently, which helps us see opportunities, possibilities and potential that others can’t. Think engineering. Think again. Want to know more? You can learn more about what it’s like to work at Aurecon by visiting the careers section of our website. If you are intrigued or excited by what you have read, then we want to hear from you. Apply now!",No salary found,
101,2020-02-09 13:52:14,data+scientist,Melbourne+VIC,https://au.indeed.com/rc/clk?jk=b8af8e64405e41fd&fccid=faf12533d2d430f4&vjs=3,Data Scientist,Northbridge IT Recruitment Propr,Melbourne VIC 3000,"Permanent role CBD location Data Science   Our Client  Our client is looking for a Data Scientist to join their newly formed in-house Data Science team. Our client is looking to bring all things analytics and Machine Learning to their current approaches and are looking for a dedicated Data Scientist to work with the Head of Data to pave the way forward for their next 10 year strategy  Ideally you will have: 3-5 years’ experience working with Java 8 / Python / R Experience with big Data technologies such as Spark / Hadoop Experience working with data languages such as Kotlin, Scala or Go Experience with Azure is a must Experience within Deep Learning, Data Structures, & Algorithms Experience within NLP / NLU Highly skilled within Machine Learning & AI PhD in Computer Science or equivalent  Next Step If this sounds like you, you can (confidentially) apply using the Apply for this Job button below. I will contact you prior to releasing your details to the client.  Lian Olifent Recruitment Consultant - Northbridge IT Recruitment 0478091651 lian@nbridge.com.au  For this and other opportunities please visit: http://www.northbridgerecruitment.com/content/OpenVacancies  Only shortlisted candidates will be contacted. SPONSORSHIP IS NOT AVAILABLE for this role. Australian PR or Citizenship is required.",No salary found,3000
102,2020-02-09 13:52:16,data+scientist,Melbourne+VIC,https://au.indeed.com/rc/clk?jk=87bfb516a2bb32f7&fccid=cce05571ecce6882&vjs=3,Data Scientist,Xpand Group,Melbourne VIC 3000,"Brand new team CBD Location Excellent opportunities for career progression   About the Role   This is a great opportunity to be a key contributor in a high-performance team of data engineers and data scientists, working collaboratively within cross-functional Remediation squads to support the timely resolution of Events across the CX Business Unit.     What you’ll be doing: Be one of the pioneers of the strategic data agenda by adopting cutting edge cloud-based analytics technology and collaborating with the Enterprise Data team. Where necessary, come up with innovative and intuitive analytical methodologies to (a) gain insights into complex populations and (b) can triage and segment populations in rational fashion for potential testing. Learn and consider the business requirements, governance processes and regulatory requirements regarding remediation events and help stakeholders understand data analysis assumptions, constraints and outputs Build, test and document calculators/models used in customer remediation events and ensure that they comply with the Model Risk Policy and maintain and leverage repository of rules, models and calculators to maximise efficiency and quality Bring your passion for data - participate in the Enterprise Data Analytics community and work closely with Enterprise Data to improve tools, processes or documentation if it’s not right or not working Manage the hygiene and quality of your analysis which includes documentation (e.g. processes, assumptions, risks on Wiki/Confluence/Teams), version control (e.g. GIT) and peer reviews Actively participate in our dynamic, agile team by supporting workload planning (e.g. sprint planning, sprint reviews, using Jira), working autonomously but collaboratively and suggesting improvements to help us improve Risk accountability forms part of all roles, as everyone is responsible for managing risk and compliance    Skills & Experience:  Understanding of statistical techniques and approaches and the application of these for customer event analysis Intermediate proficiency in SQL (3+ years) Solid experience in performing complex data analytics tasks in data warehouse (3+ years) Preferred hands-on coding experience in Python/R Preferred working experience on cloud platforms, including S3, Redshift and/or DynamoDB Data visualisation (e.g. Tableau, Qlik) is a plus Financial Services experience is highly regarded Communication skills (written and verbal) Ability to collaborate across teams Commercial problem-solving capability  Benefits:  Numerous programs including rewards and recognition, health and well-being; alongside a wide range of staff discounts    How to Apply:  This is a great opportunity to join an award winning company as it goes from strength to strength. If you believe this role is for you, please apply by sending your CV via the big button below",No salary found,3000
103,2020-02-09 13:52:17,data+scientist,Melbourne+VIC,https://au.indeed.com/rc/clk?jk=559c18e1cccbe758&fccid=bb7ef3285fef17be&vjs=3,Data Scientist (First of it's kind Project),Firebrand,Melbourne VIC,"Opportunity to truly make a positive impact to Victorian's in a first of its kind project in Melbourne - high profile real time predictive platform to elevate an Emergency Services organisation with real time data  This is a high-profile engagement based in the Melbourne's North-East which is probably the first of its kind in Australia in terms of depth and scale of capabilities that are being deployed to an emergency services provider. Within the overall solution, our client is building a web front-end (react and node.js) designed to deliver/render complex insights from the underlying Data and AI platform through a single-pane-of-glass. - platform Azure  The Role: The Data Scientist designs, develops and implements practical and scalable analytic solutions. These typically involve a combination of analytical, process and business transformation outcomes and focus on areas of our client’s business such as customer, product and supply chain, just to name a few. You will work with business stakeholders on factual problem formation, data identification and deriving answers that can be operationalized to solve business issues. You will work proactively to:  Determine the suitability and feasibility of an analytical solution for a given commercial problem  Review existing data sources to assess their applicability to address the business problem, and/or propose additional sources required for a solution  Extract and manipulate data from a variety of sources and apply the appropriate pre-processing treatments for analysis.  Support the selection and configuration of analytical tools and infrastructure appropriate to our clients’ objectives, current and target state analytic maturity.  Design, develop and implement learning and/or optimisation solutions in areas that might include asset and inventory management, communications, channels and networks, risk and portfolio analysis, supply chain management and marketing effectiveness.  Design, develop and implement predictive models for areas such as customer segmentation, market basket analysis, offer propensity, demand planning & forecasting, fraud detection, inventory management and risk exposure.  Design, develop and implement approaches for productionising model scoring and the closed loop feedback paths required to support back-testing/test-and-learn model validation.  Apply visual analysis techniques and toolsets to extract patterns and meaning from data in a visual format.  Translate analytical solution outcomes in the context of business impacts and benefits.  You will Bring: Excellent interpersonal, oral and written communication skills with a knack for distilling complex and/or technical information for novice audiences.  An eagerness to solve complex problems in environments that are often ambiguous, technologically challenged and require creative and lateral thinking.  A disciplined approach to problem solving and an ability to critically assess a range of information to differentiate true business needs as opposed to user requests.  An ability to work within a multidisciplinary team to seek requirements for analysis, output format and visualisation, and provide requirements to data engineers  Experience with the following technologies & languages  Fluency in at least one of the following programming languages: R, Python, Scala  Familiarity with the following data-related technologies: Hadoop, Pig, Hive, Impala, SQL, Teradata, Oracle, SAS, MongoDB  High-level understanding of architecting cloud-based solutions with the following products: AWS Redshift/RDS, S3, EC2, Lambda, EMR, SageMaker, DynamoDB, Cloudformation, Athena, Kinesis – or equivalents in Azure or Google Cloud Platform.  Please email your c.v: znicolson@firebrandtalent.com  Zena Nicolson: 03 8644 7777",No salary found,
