,search_date,search_term,specified_search_location,job_url,job_title,company,location,description,salary,postcode
0,2020-02-09 13:49:15,research+scientist,Melbourne+VIC,https://au.indeed.com/pagead/clk?mo=r&ad=-6NYlbfkN0AB3vSntJrBZbEYTyMRVQUEEN2FmeGb60ApE48x_hMTy_-4cT7vsI957wmzsCRJIJ_GjmOylEuGNkgrmCJIqbu9CmLlwr1-d9y4gThGodBtahBOAYt_tOE_2ie7Iv5FB4p1qO2Ofo6kHdkmXpHkqd93nYuZPZlwzl063f15NyRSPtdT5RePu6fZbpdsMCT8QPz_BVMnPJgPe59otwHzagQcuFviH816-LTQBa6sjlHz-v6yo93zZUgPe2djSYjiONvfY_mYKrYCg3Jgpwxv-9sZ-HhVHPO8CYhBUWeUk3sDutzz1cSPlYwvxi1-P8_kWUxDKd-ry8K3dImggWrMTtHDiSgKkdgbJCpaLGPopuTftRCML7kcR96l525epWbn5GIvCRFO_51yJPaUY4lSCc3qu6RffNJ0OKC1bxoYNgjb7-snKTm2PC1GHd-zF8IOK1yxLIbNB_hDUBOnsj8NvDo-pFHCJtuTXlbPOnCRzY4P1yuMjiV2XWCSjcKW8B0Wxtq5IZw4qpgQ1nxXkD48GnM5rhNLMVcXAOUo5WJy-EdcXZYxMB1ZjMP2_gc0m-08LKwnMKxfdoY8800nMx7HaBRGQCvs3Qd2mhp4QeIjAWjcawahYRlutkRw9fLAvXC0pYHb-sC0unmo-TUyNxYsdPwHpZsPRwu0ToXfwJXrLYq9UfDDxsfk3NS1-QIyDoQW92NuMKK-caJ9GahjNTz3ZD5ZZP_ziWUchnE6rJo3Bbp75nuKaU8iz70TOOp-XZUU9PVRnpejwrcR8gTnzTyNcb3ebga3FBG9Xbckg9FOJkxwK97drh_-B7pRAk6tIJDcht4vaQiXG6RWByAsY_cmh_qbvXaf048Z07KLywnQiUUbteCNqVEs69OjrKTTsmuIpqIUVMoq9CWsfM1Cf1GQN2v9TrAoa9EiKvxpQgv_qQKIzEnf34BYOiKZKMsKV5WMzRni_5W0nzVCeJY9uPEpIVfx8oVcTqVrOoOD6Xu05H0Bo71qRZ-95BtQ_E_XEok_R7p_5a_uLnZhn5MdA_pQoNt4eF-zsML1lZ2SSwApQN-EeawVigwHQeoMjR7jMG4vOGuLVyrykm037u7GvBqtYD-TTij2Od_O7slPqY5xTqT9TH21EgOnq452XQ4RrF_tHuEiXOcW9_72E3QezKjUlSo5owgYhgNCxNE5V4anyISZ5F7njzdO0Sg6HB-oETYrMyw=&p=0&fvj=0&vjs=3,"Manager, Research & Development (Upstream, Cell culture expert)",Thermo Fisher - APAC,Melbourne VIC,"How Will You Make an Impact?  Based in Singapore, this position manages a cell culture media optimization team that works directly with pharmaceutical companies to develop high performing bioproduction media formulations that enhance the titer and quality of the drugs they produce. Many of the life saving cancer drugs today are too expensive to produce for world wide consumption. This team provides drug companies a way to manufacture their drugs more efficiently making these drugs more accessible to the world. We at Thermo Fisher Scientific work every day enabling our customers to make the world healthier, cleaner and safer. As we expand in Asia to service the many new companies that entering the Bioproduction area we are also expanding our efforts in the region to support the next generation drugs that rely on gene therapy and stem cell therapy. This is a rapidly expanding area of health care and we are committed to be part of the innovative solutions that will be necessary for these new therapies to be successful. What will you do?  This position provides the technical leadership to an experienced team of scientists engaged in media development. There is a requirement for strong technical interaction with pharmaceutical companies to discuss their issues and map out technical projects. You will be part of the technical leadership of our R&D team within the United States to ensure you are part of our future and innovative solutions for the industry.  Develop and optimize cell culture media and processes suitable for manufacture and meeting customer requirements for large scale production of recombinant proteinsMaximize potential for successful scale-up manufacturing and technology transferEnsure new media satisfy project goalsUnderstand product development processes; able to lead product development teamsSupport upstream cell culture operationsLead a media development team developing media formulations for customer cell linesAdhere to EHS standards and complies with Thermo Fisher Scientific laboratory quality systemsRotational week end work will be expected  How will you get here?  It is important for the candidate to have experience in cell culture media development and team management experience. Good customer facing skills are important for this role. I. Education A PhD degree is required3 + years of relevant work experience.  II. Experience Essential Criteria Minimum of 8-10 years’ experience in bio/pharma industry in the area of mammalian cell culture (CHO)Demonstrated significant accomplishments leading cross-functional technology and product development teamsScale-up manufacturing, technology transfer, and record of successful accomplishment on cross-functional teamsParticipation on successful product development teamsMust have extensive and technical expertise relating to mammalian cell culture, media development and cell culture process development disciplinesUnderstands new scientific concepts and ideasAptitude for statistical analysis and experimental designExcellent grasp of sterile techniquesExcellent organizational skills, including the ability to efficiently evaluate, and prioritize multiple and changing prioritiesAble to work independently.  III. Knowledge, Skills, Abilities Strong written, verbal. and presentation skillsAble to supervise multiple technical teams and subordinates who exercise considerable independenceAbility to interact effectively with customersExperience in statistical media design software (DesignExpert)Experience in high-throughput small-scale cell culture systems eg.deepwell plates and spin-tubes and AMBR microbioreactor systemExperience with Sartorius bench scale bioreactor systems and ATF systems",No salary found,
1,2020-02-09 13:49:16,research+scientist,Melbourne+VIC,https://au.indeed.com/rc/clk?jk=634858be9d195371&fccid=de71a49b535e21cb&vjs=3,IBM Research Scientist -AI-NLP Melbourne,IBM,Melbourne VIC 3001,"Introduction IBM Research Scientists are charting the future of Artificial Intelligence, creating breakthroughs in quantum computing, discovering how blockchain will reshape the enterprise, and much more. Join a team that is dedicated to applying science to some of today's most complex challenges, whether it’s discovering a new way for doctors to help patients, teaming with environmentalists to clean up our waterways or enabling retailers to personalize customer service.  Your Role and Responsibilities IBM Research Scientist -AI-NLP Melbourne  Offered on a permanent regular employment basis or on a fixed term hire 24 Months basis  From landing the first astronauts on the moon to building the first cognitive system to win Jeopardy! IBM with its diverse culture, continues to be the innovative spark of the computing revolutions that shape our world. At the core of IBM’s innovation are its 12 global research labs. IBM Research Australia is a young, proud and diverse community working on industry solutions, conceiving, designing and building next generation enterprise systems.  IBM Research is seeking a highly motivated and passionate researcher to join our Cognitive Analytics team. Our mission is to develop novel Artificial Intelligence (AI) techniques and use established machine learning methods to understand and gain insights from unstructured (primarily text) data in various industrial domains, such as financial services, government, defence, health, etc. Such capabilities allow our users and clients to be more efficient in their business and maybe even discover intelligence that wasn’t previous known.  We are seeking a proactive, passionate researcher to work in our team and contribute to our AI applications for industrial data science. The candidate will contribute across disciplines and geographies to work towards developing the transformational ideas that will have impact on the world.  What will I be doing? Working with a team of established researchers and software engineers on client and internal data science projects. Fundamental research into machine learning (including deep learning) methods and their application to unstructured textual and other data. Expected to implement and communicate ideas through publications and conferences, contributions to IBM’s patent portfolio, as well as software demonstrations and assets, and Proof of Concepts. Opportunities to network not only with local colleagues but also have access to a global network of eminent and passionate researchers and engineers only too willing to share their knowledge.  What skills will I need? Demonstrated experience developing statistical and machine learning models. Experience working with big data sets, especially in secure environments. Lifecycle of machine learning project development and management. Domain knowledge in any of the financial industry, government, defence, or healthcare and life sciences.  What experience do I need? At least two years of Data Science and/or Natural Language Processing (NLP) experience after a Doctorate Degree in Computer Science or related field. Demonstrated experience with deep learning using open source frameworks such as Tensorflow, PyTorch, Keras, DL4J. Experience in software development, within teams, in at least one of Python, Java or other comparable scientific or statistical programming environments. Demonstrated academic output documented via journal/conference publications in the field Compensation package from $87,500 (full-time equivalent inclusive of superannuation) and will be determined based on successful candidates’ relevant skills and experience.  The successful candidate must be eligible to obtain an Australian Security Clearance.  To apply: Upload your CV, cover letter, academic transcript and your Right to Work document   Required Technical and Professional Expertise  As above  Preferred Tech and Prof Experience  As above  EO Statement IBM is committed to creating a diverse environment and is proud to be an equal opportunity employer. All qualified applicants will receive consideration for employment without regard to race, color, religion, gender, gender identity or expression, sexual orientation, national origin, genetics, disability, age, or veteran status. IBM is also committed to compliance with all fair employment practices regarding citizenship and immigration status.    Required Technical and Professional Expertise As above   Preferred Technical and Professional Expertise As above  About Business Unit We are seeking a highly motivated and passionate researcher to join our Cognitive Analytics team. Our mission is to develop Artificial Intelligence (AI) technologies to understand and gain insights from massive volumes of textual data in various industrial domains, such as financial services, government, defence, etc. Such capabilities allow our users and clients to be more efficient in their business and maybe even discover intelligence that wasn’t previous known. In order to make this a reality, we develop AI and advanced machine learning methodologies in collaboration with users. We are seeking a proactive, passionate researcher to work in our team and contribute to our AI applications for industrial text analytics. The candidate will proactively contribute across disciplines and geographies to work towards developing the transformational ideas that will have impact on the world.  Your Life @ IBM IBM Research Scientist -AI-NLP Melbourne   Melbourne BasedOffered on a permanent regular employment basis or on a fixed term 24 months basisCompensation package from $89,250 (full-time equivalent inclusive of superannuation) and will be determined based on successful candidates’ relevant skills and experience.  About IBM You will work with a team of established researchers and software engineers to generate new ideas and will be expected to implement and communicate these ideas through publications and conferences, contributions to IBM’s patent portfolio, as well as software demonstrations and assets and Proof of Concepts (PoC). Research Staff Members have the opportunities to network not only with local colleagues but also have access to a global network of eminent and passionate researchers and engineers only too willing to share their knowledge. You will also have the opportunity to explore all IBM has to offer throughout the whole research-development-delivery pipeline.  Location Statement For additional information about location requirements, please discuss with the recruiter following submission of your application.  Being You @ IBM IBM is committed to creating a diverse environment and is proud to be an equal opportunity employer. All qualified applicants will receive consideration for employment without regard to race, color, religion, gender, gender identity or expression, sexual orientation, national origin, genetics, disability, age, or veteran status. IBM is also committed to compliance with all fair employment practices regarding citizenship and immigration status.","$89,250 a year",3001
2,2020-02-09 13:49:18,research+scientist,Melbourne+VIC,https://au.indeed.com/rc/clk?jk=f79b1e7f9c958683&fccid=c4e7588784d31d54&vjs=3,Junior Data Scientist,Newgate Communications,Melbourne VIC 3000,"About the Business and the Role:  Are you a junior data scientist or analyst with strong numeracy, research and communication skills developed over 2-4 years of experience, and who is interested in current affairs and what drives opinion? Are you interested in finding the story in the data? Are you keen to understand what goes on behind the scenes of the main stories in the news?  Newgate Research is seeking a talented junior data scientist to join our team in Melbourne. We are a specialist market and social research firm that helps corporates, governments and industry associations understand and measure the views of the community and other stakeholders. We work on issues, reputation and identifying the best ways for our clients to communicate and engage. Our findings help clients identify ways to shift knowledge, attitudes and behaviour and make decisions on the basis of objective fact and not gut feel or assumption.   Newgate Research is part of Newgate Communications, a strategic communications advisory firm with 80+ staff with offices in Sydney, Melbourne, Canberra, Brisbane and Perth. Newgate Communications works across public affairs, corporate communications, financial communications, stakeholder and community engagement and digital engagement.  Newgate Research uses a broad range of methodologies – from the traditional to the more innovative – including focus groups, in-depth interviews, deliberative forums, online communities, telephone surveys and online surveys. It was the 2016 Research Industry Council of Australia's Employer of the Year.   The role is based in Melbourne and is suitable for a recent university graduate with a degree in a relevant area such as market or social research, computer sciences, the hard or soft sciences (e.g. biology, physics psychology etc,.) or similar. You will have a sound level of understanding in statistics and analytical approaches to complex data sets.   This role will assist the Data Scientist and broader Newgate Research and Newgate Digital teams in design, analysis and reporting tasks related to data gathered from online networks and market and social research. The outputs will be used to inform strategic communications advice to clients. More broadly they will assist in driving innovation within Newgate Australia.  On the job training and professional development opportunities will be provided. You will have a mentor to guide you for questions and career planning and a team of experienced people around you to leverage off their knowledge and experience. We work collaboratively in teams, both within the research business and cross teams with the communications consultants. The role brings opportunities to learn, grow, develop and contribute to meaningful work within a high performing team environment.   Specific responsibilities will include:  Assisting with coordination of quantitative research projects, including project design, data analysis and reporting; Assisting with preparation of new business proposals and tenders; Assisting in the monitoring of industry developments and encouraging innovation within the business; Assisting in new business development and/or development of new business lines; and Playing a supporting role in the Analytics function, helping train other staff in advanced analytical methods and providing support in analytics tasks.   The ideal candidate will:  Be a self-starter who is comfortable working in a fast-paced consultancy environment; Be well organised and have strong attention to detail; Be a good team player; Have strong writing and communications skills, particularly through explaining complex quantitative concepts to individuals unfamiliar to the domain; Be available for qualitative research events on some evenings and for occasional interstate travel; Have expertise in the full Microsoft Office suite, as well as in programming languages (such as SQL, R, Python, SAS etc.); and Ideally have working knowledge of exposure to statistical software programs such as Q, SPSS or similar (training can be provided).   The position is available immediately and applicants should apply with their details, covering letter and a brief resume outlining why they are interested in this role and what they believe they can offer Newgate Research.","$65,000 a year",3000
3,2020-02-09 13:49:21,research+scientist,Melbourne+VIC,https://au.indeed.com/rc/clk?jk=2d0c155fd069e123&fccid=de71a49b535e21cb&vjs=3,IBM Research Scientist – Blockchain Postdoc FTH 24Months Melbourne,IBM,Melbourne VIC 3001,"Introduction IBM Research Scientist – Blockchain Postdoc FTH 24Months Melbourne  Melbourne Based24 Month Fixed Term HireCompensation package from $89,250 (full-time equivalent inclusive of superannuation) and will be determined based on successful candidates’ relevant skills and experience.  Your Role and Responsibilities Candidates will be joining a team of researchers and software engineers to conceive, build, test and deploy solutions for some of the world’s challenging technology problems. You will be working under the direction of senior IBM research scientists globally and will be expected to publish at high quality academic conferences and journals as well as relevant industry venues.  Ideal candidates will have expertise in several of the following areas: A solid understanding of state-of-the-art research in the field of distributed systems. Expertise in designing, developing, and evaluating distributed systems middleware. A solid background in programming and exposure to end-to-end software development practices.  Required Experience: A recent PhD in Computer Science or related field. Worked on one or more projects that involved the application of principles in distributed systems in areas relating (but not limited) to distributed databases and file/storage systems, distributed protocols, peer-to-peer systems, fault-tolerant and highly available systems, and scalable operating systems. Designed, developed, and evaluated methods and algorithms for solving distributed systems problems. Expertise in one or more programming languages, and a strong background in data structures and algorithms. Exposure to Distributed Ledger Technologies will be viewed very positively. Exposure to Cryptography, Game Theory and Mechanism Design will be viewed very positively. Experience working in teams and have applied well-known end-to-end software development practices.    Required Professional and Technical Expertise As above   Preferred Professional and Technical Expertise As above  About Business Unit With more than 3,000 researchers in 12 labs located across six continents, IBM Research brings together hundreds of researchers who possess unparalleled industry expertise to address some of the world's most challenging problems. Join us as we do pioneering work in areas such as cognitive computing, augmented intelligence, quantum computing, and blockchain, to name a few.  Your Life @ IBM From landing the first astronauts on the moon to building the first cognitive system to win Jeopardy! IBM with its diverse culture, continues to be the innovative spark of the computing revolutions that shape our world. At the core of IBM’s innovation are its 12 global research labs. IBM Research Australia is a young, proud and diverse community working on industry solutions, conceiving, designing and building next generation enterprise systems.  About IBM IBM Research Australia is looking for a Postdoctoral Researcher to join our Blockchain Platforms team. This team is working on challenging long-term problems in the areas of Blockchain interoperability, scalability, value networks and governance, while also working with enterprise clients to realise the value of blockchain systems today.  Location Statement For additional information about location requirements, please discuss with the recruiter following submission of your application.  Being You @ IBM IBM is committed to creating a diverse environment and is proud to be an equal opportunity employer. All qualified applicants will receive consideration for employment without regard to race, color, religion, gender, gender identity or expression, sexual orientation, national origin, genetics, disability, age, or veteran status. IBM is also committed to compliance with all fair employment practices regarding citizenship and immigration status.","$89,250 a year",3001
