trial_lie_037.mp4,1,0,0,0,1,0,0,0,1,0,0,0,0,0,0,1,0,1,1,0,0,0,0,0,0,0,0,0,0,0,1,0,0,0,1,0,0,0,0,deceptive,"He straddled me and he hit me and then he started choking me. I couldn't breath my umm airway was cut off, I couldn't breath. Umm my head was hurting really bad. and it it felt like my head was gonna explode",90.05,a female,Showing no emotion,67,6,3.0,14.3,22.4,0.6,183.07,32.49,179.9,75.0,367.0,173.0,195.0,0.07319622165938473,0.00033895892334181033,0.0409424950411902,0.04300369953201519,0.1228274851235706
trial_lie_038.mp4,1,0,0,0,1,0,0,0,1,0,0,0,0,1,0,0,0,1,1,0,0,0,0,0,0,0,0,0,0,0,1,0,0,0,1,0,0,0,0,deceptive,"I was trying to say something but I couldn't talk. I tried to push him off me but he was too strong. Um all I could think about was my kids telling me \Mom, you don't go, don't go.""",100.0,a female,Showing no emotion,54,2,4.0,10.2,14.2,0.7,186.02,35.48,179.6,74.0,375.0,171.0,193.0,0.07449222513155415,0.00034702635325495123,0.041618406976759,0.044654098833385156,0.12485522093027698
trial_lie_039.mp4,1,0,0,0,0,0,1,0,1,0,0,0,0,0,0,1,1,0,0,0,0,1,0,0,0,0,0,1,0,0,0,0,0,0,1,0,0,0,0,deceptive,"I didn't really know her too well, I only saw her a couple of times. Not really no, I wasn't placing her face with her address. No, I didn't talk to anybody, I just lived, I would go to school and come home.  Uh, no.",90.2,a female,Showing no emotion,60,5,3.0,13.0,19.2,0.7,191.7,48.43,182.2,73.0,358.0,168.0,210.0,0.06936060667183694,0.00031410506145875775,0.037639126244642634,0.04129271806963601,0.1129173787339279
trial_lie_040.mp4,1,0,0,0,0,1,0,0,0,0,1,0,0,0,0,1,1,0,1,0,0,0,0,0,0,0,0,0,0,0,1,0,0,0,1,0,0,0,0,deceptive,"Yes, he said he did. And he told me to take care of my wounds as necessary. No he said there was several wounds. Um he advised me to take Tylenol when I get the gel and um asked him for something to put on, put on my face.",94.99,a female,Showing no emotion,71,5,4.0,13.4,17.4,0.8,177.05,38.49,173.6,73.0,391.0,168.0,188.0,0.06702038698778934,0.00032930156346806534,0.03734984455798612,0.039801942051739314,0.11204953367395837
trial_lie_041.mp4,1,0,0,0,0,1,0,0,1,0,0,1,0,0,0,0,1,0,1,0,0,0,0,0,0,0,0,1,0,0,0,0,0,0,1,0,0,0,0,deceptive,"Remember, we withheld the evidence in this very important case that we want to try to get to the truth and to the bottom of. Well who says it not a criminal investigation, it's an investigation that is undetermined at this time. And uh we're just not prepared to make any assertions as to uh what the outcome is going to be until it's a full and thorough investigation.",94.95,a Male,Reading,83,4,4.0,18.8,20.1,0.9,121.99,24.33,117.0,82.0,380.0,107.0,132.0,0.04959290228670065,0.0003512728365516973,0.023864535053558043,0.02501145148356356,0.07159360516067413
trial_lie_042.mp4,1,0,0,0,0,1,0,0,1,0,0,0,1,0,0,0,1,0,1,0,0,0,0,0,0,0,0,0,1,0,0,0,0,0,1,0,0,0,0,deceptive,"They found the man uh in the secure area with his luggage cart and chairs set around him. Uh they tried to do the same thing, communicate with him. Chairs went flying, he grabbed a computer off a desk and threw that. Um they just weren't getting through to this guy and the violence, again, escalating.",100.0,a Male,Reading,76,6,4.0,17.5,20.9,0.8,117.09,17.53,115.7,81.0,358.0,110.0,122.0,0.058778138813782736,0.00038714891787649326,0.02947828991165315,0.031801177356058065,0.08843486973495945
trial_lie_043.mp4,0,0,0,1,0,1,0,0,1,0,0,0,0,0,0,1,1,0,1,0,0,0,0,0,0,0,0,1,0,0,0,0,0,1,0,1,0,0,0,deceptive,It didn't have an instantaneous effect and Mr. Dziekanski still had the stapler in his hand. And uh he had not gone down. Just cause I was mistaken doesn't mean I was lying. I did the best job I could at the time.,94.95,Voice not recognized,,46,2,4.0,9.9,11.7,0.8,95.94,29.96,87.9,79.0,296.0,84.0,93.0,0.06531322260608154,0.0005971052112860016,0.03263484814576184,0.03512304970321086,0.09790454443728552
trial_lie_044.mp4,1,0,0,0,0,0,1,1,0,0,0,1,0,0,0,0,1,0,0,1,0,0,0,0,0,0,0,0,0,0,0,1,1,0,0,0,0,0,1,deceptive,"None of us. We're out there, looking for three people that were just involved in a uh shooting of another three individuals out on a street corner.",95.03,a Male,Showing no emotion,34,3,4.0,7.1,8.1,0.9,98.18,12.77,94.8,78.0,153.0,90.0,103.0,0.04881159977856091,0.00044781107310993255,0.021350350718796048,0.024055602442182182,0.06405105215638815
trial_lie_045.mp4,1,0,0,0,1,0,0,1,0,0,0,0,1,0,0,0,1,0,0,1,0,0,0,0,0,0,0,0,0,0,0,1,1,0,0,0,1,0,0,deceptive,"We do not know about, how quote, responsible CHR's share holders are because that dataset is not available and is completely locked down. Any statements about responsible and quote law-abiding CHR are is completely anecdotal and therefore conjecture. ",100.0,a female,Reading,79,3,4.0,15.7,19.1,0.8,226.0,39.5,222.2,82.0,394.0,203.0,242.0,0.07310135689350236,0.0002815676907290832,0.03871506133722464,0.0423352512405613,0.11614518401167392
trial_lie_046.mp4,1,0,0,0,0,0,1,1,0,0,0,0,0,0,0,1,1,0,1,0,0,0,0,0,0,0,0,0,0,0,0,1,0,1,0,1,0,0,0,deceptive,"The first time I remember Mr. Miller he was...having kinda like an argument with the officers as we were moving the people out of the area toward the street, so that they could uh block the uh sidewalk. And uh, he was being very aggressive with the officers, we didn't understand why. We just needed everybody to follow orders, we just wanted everybody's safety. I mean we just have to give the orders to step down to the street.",100.0,a female,Showing no emotion,114,9,3.0,24.9,33.0,0.8,191.66,33.64,190.6,78.0,390.0,175.0,206.0,0.0868948676746327,0.00043214168160706775,0.04542270157280019,0.050046595546606454,0.13626810471840056
trial_lie_047.mp4,0,1,0,0,0,0,1,0,0,1,0,1,0,0,0,0,1,0,0,1,0,0,0,0,0,0,0,0,0,0,1,0,0,0,1,0,0,0,0,deceptive,"No, not at any time. He called me some names, but that wasn't really a conversation.  It wasn't a two part conversation. ",80.08,a female,Showing no emotion,28,1,3.0,6.4,10.6,0.6,169.32,44.03,163.2,84.0,371.0,152.0,177.0,0.08050411376189442,0.00041101640895162993,0.04089718960864681,0.046633213598754955,0.12269156882594043
trial_lie_048.mp4,0,1,0,0,1,0,0,1,0,0,0,0,0,0,0,1,0,1,0,0,1,0,0,0,0,0,0,0,0,1,0,0,0,1,0,1,0,0,0,deceptive,"He used the f word several times. Okay, I'm sorry. Let me rephrase that. He made mentioned of the f word towards me several times.  ",89.96,a Male,speaking passionately,37,3,3.0,8.8,11.5,0.8,153.82,50.94,144.0,86.0,382.0,123.0,158.0,0.09424009091443615,0.0004936756945317077,0.05050151767498897,0.054899766039722686,0.1515045530249669
trial_lie_049.mp4,0,0,0,1,0,1,0,0,1,0,0,1,0,0,0,0,1,0,1,0,0,0,0,0,1,0,0,0,0,0,0,0,0,1,0,1,0,0,0,deceptive,"With the word 'you' in front of it. So I would assume that 'you' would be... If I said you, you would say- you would assume it's you.",100.0,a Male,speaking passionately,46,2,4.0,10.5,11.6,0.9,147.23,42.9,139.3,87.0,389.0,123.0,154.0,0.09178794319769171,0.000527129162575316,0.04776306113766765,0.053969110010887646,0.14328918341300295
trial_lie_050.mp4,0,0,1,0,0,0,1,0,0,0,1,1,0,0,0,0,1,0,0,1,0,0,0,0,0,0,0,0,0,0,0,1,1,0,0,0,0,0,1,deceptive,"With a fist. On my temple. And he kept hitting the same spot. I guess my head's not as strong I'd like to believe it is. No, I went to the doctor and ... It was four days after. He finally went back to work. ",100.0,a female,Showing no emotion,52,6,4.0,9.4,12.3,0.8,193.83,67.73,184.6,78.0,368.0,175.0,214.0,0.07417214113901244,0.0003285592014146039,0.03820725584087974,0.03841845578855053,0.11462176752263922
trial_lie_051.mp4,0,0,0,1,0,1,0,0,1,0,0,1,0,0,0,0,1,0,1,0,0,0,0,1,0,0,0,0,0,0,0,0,1,0,0,0,0,1,0,deceptive,Why would she take a hammer and hit him...,100.0,a female,Reading,25,2,4.0,4.7,5.9,0.8,205.56,83.94,191.7,81.0,356.0,128.0,294.0,0.09381682263473261,0.0003211656087112007,0.04735373277048418,0.05302156541682519,0.14206119831145253
trial_lie_052.mp4,0,1,0,0,0,0,1,0,1,0,0,0,1,0,0,0,1,0,0,1,0,0,0,0,0,0,0,0,0,0,0,1,0,0,1,0,0,0,0,deceptive,"No, no. I did not and I had absolutely nothing to do with her disappearance. And I'm glad that she did. I did. I did. Um and then when Laci disappeared, um, I called her immediately. It wasn't immediately, it was a couple of days after Laci's disappearance that I telephoned her  and told her the truth. That I was married, that Laci's disappearance she didn't know about it at that point.  ",89.89,a Male,Reading,95,10,3.0,20.5,28.4,0.7,117.93,20.74,111.4,82.0,219.0,104.0,125.0,0.09630673367692903,0.0007217920333299641,0.047857633306055726,0.05514764420182128,0.14357289991816718
trial_lie_053.mp4,0,0,0,1,0,1,0,1,0,0,0,1,0,0,0,0,1,0,1,0,0,0,0,0,0,0,0,0,0,0,0,1,0,1,0,0,1,0,0,deceptive,"Either a barrel or a stick but certain, they are like, they are going to kill you. I'm at lost at justifing what I did in a second valley other than saying that I thought that they were shooting back. ",100.0,a Male,Showing no emotion,76,4,4.0,16.5,18.6,0.9,110.97,29.35,102.4,81.0,294.0,94.0,114.0,0.08637531452111954,0.0006565010487424866,0.045721918719094506,0.04958975934369394,0.13716575615728352
trial_lie_054.mp4,0,0,0,1,0,1,0,1,0,0,0,1,0,0,0,0,1,0,1,0,0,0,0,0,0,0,0,1,0,0,0,0,0,0,1,0,0,0,0,deceptive,"... Do I believe the evidence that supports domestic violence? Yes. I I think  bias is an incorrect word, Mr. Martinez. I don't believe I'm biased.",94.93,a female,Showing no emotion,26,0,4.0,5.4,5.9,0.9,175.83,23.8,176.8,80.0,280.0,170.0,187.0,0.07141146801017366,0.00025194540553989973,0.03927513045849838,0.04250573373036414,0.11782539137549515
trial_lie_055.mp4,0,0,0,1,0,1,0,1,0,0,0,0,0,0,0,1,1,0,1,0,0,0,0,0,0,0,0,1,0,0,0,0,0,1,0,0,1,0,0,deceptive,"There was a lot of talk about me being, you know, seduced by Jodi. And frankly, Jodi is not that seductive as a person. She's pretty straightforward, uhm, and what Jodi did was terrible. But Jodi isn't terrible. And I think the media... You had Nancy Grace, you had Jane Velez Mitchell, and you had Dr. Drew, who is very insidious because he sounds sane.",89.9,a female,Showing no emotion,101,11,3.0,25.4,31.3,0.8,172.2,28.84,170.0,80.0,372.0,154.0,186.0,0.04464231115822584,0.0002244352031729762,0.021661545677223847,0.022353084800857254,0.06498463703167154
trial_lie_056.mp4,1,0,0,0,0,0,1,0,0,1,0,1,0,0,0,0,0,1,1,0,0,0,0,0,0,0,0,0,0,0,0,1,1,0,0,1,0,0,0,deceptive,"yes, I believe she was in an, er,  abusive relationship. Yes, I do. Um, certainly putting down friends and family. Um, there is some destruction of property but it seems minimal at this point. Um, a change in the victim's personality... ",89.78,a female,Showing no emotion,62,7,3.0,12.5,18.4,0.7,185.29,22.65,182.9,80.0,254.0,171.0,197.0,0.056196793168578535,0.0002677675353232946,0.028940829781151613,0.030910529813525982,0.08682248934345484
trial_lie_057.mp4,0,0,0,1,0,0,1,0,0,1,0,1,0,0,0,0,1,0,1,0,0,0,0,0,0,0,0,0,0,0,0,1,0,1,0,1,0,0,0,deceptive,"That word has a definition and you are not using it. You are not using the definition that I apply in this ... in this continuum. So if you want me to talk about what stalking means, I will talk about it.",100.0,a female,Showing no emotion,73,1,5.0,14.8,15.2,1.0,185.3,26.41,187.0,85.0,283.0,178.0,197.0,0.06471738160565174,0.0003078849090065677,0.034118037702232894,0.03625022315600757,0.10235411310669867
trial_lie_058.mp4,1,0,0,0,1,0,0,1,0,0,0,1,0,0,0,0,0,1,1,0,0,0,0,0,0,0,0,1,0,0,0,0,0,0,1,0,0,0,0,deceptive,100 percent. Absolutely. 100 percent. 100 percent. Totally false. Do I have remorse? Absolutely. ,84.83,a Male,speaking passionately,32,4,3.0,6.1,9.5,0.6,162.59,107.13,103.5,82.0,402.0,97.0,256.0,0.05977811563818279,0.00035242303244209684,0.03088642270596214,0.034256722844064856,0.09265926811788641
trial_lie_059.mp4,0,1,0,0,0,0,1,1,0,0,0,1,0,0,0,0,1,0,0,1,0,0,0,0,0,0,0,0,0,0,0,1,1,0,0,1,0,0,0,deceptive,"...um person in the congregation was involved in activities like that. The elders would sit down with the individual and try to determine what's going on. The objective is as Jesus said, \if you have a hundred sheep, and one's lost, leave the ninety-nine and go find the one\"". So the objective is to help that individual. Whether it's to er, er, worshiping er, someone or anything like that or celebrate Christmas or fornication or whatever it happens to be. The elder would mate with the individual based on person's um attitude at that time will have direct relevance to what they do. """,100.0,a Male,speaking passionately,145,14,4.0,31.3,40.0,0.8,142.65,24.49,135.1,81.0,364.0,129.0,151.0,0.06779701168099579,0.0004279405915393949,0.03505425247818039,0.03628147806943408,0.10516275743454118
trial_lie_060.mp4,0,0,0,1,0,1,0,1,0,0,0,1,0,0,0,0,1,0,1,0,0,0,0,0,0,0,0,0,0,0,0,1,1,0,0,0,0,1,0,deceptive,"My statement is this: I've never been alone with Candace Conte. I never molested Candace Conte. What do you mean think? I just told you. Never. I've never ... Okay, get this right. I've never been alone with Candace Conte, ever. Never have I been alone with Candace Conte. ",95.13,a Male,speaking passionately,75,7,4.0,15.3,20.2,0.8,156.53,71.91,131.7,79.0,413.0,114.0,163.0,0.0703799958518649,0.00028673374038450377,0.03640008599156198,0.040707507350246336,0.10920025797468594
trial_lie_061.mp4,0,1,0,0,1,0,0,1,0,0,0,0,1,0,0,0,1,0,1,0,0,0,0,0,0,0,0,0,0,0,0,1,0,1,0,1,0,0,0,deceptive,"Not at all. Oh, that's her word agains mine isn't. Who do you think? You heard her? Since then you become the biggest (inaudible) in all of this? Well, I would like to think so, but that's not for me to juge, isn't. I mean that's between him and his God. Is it not?  ",100.0,a Male,speaking passionately,59,6,4.0,11.5,16.6,0.7,137.51,32.81,127.9,75.0,376.0,115.0,156.0,0.07334240639329637,0.00046260845374652867,0.036336309311984984,0.03881074811015874,0.10900892793595496
trial_truth_001.mp4,1,0,0,0,0,0,1,1,0,0,0,1,0,0,0,0,1,0,0,1,0,0,0,0,0,0,0,0,0,0,1,0,0,0,1,0,0,0,0,truthful,"Reforming the criminal justice system matters to me because for the law to have legitimacy and the people to respect they law, they need to believe that the law treats everyone um ... equally um ... and fairly. ",94.96,a female,Showing no emotion,57,4,4.0,12.1,13.7,0.9,188.13,38.17,181.7,73.0,361.0,163.0,210.0,0.05200195253210512,0.0002362164414897973,0.025880554529431728,0.02531343235221362,0.07764166358829519
trial_truth_002.mp4,0,0,0,1,0,0,1,1,0,0,0,1,0,0,0,0,1,0,1,0,0,0,1,0,0,0,0,0,0,0,0,0,0,0,1,0,0,0,0,truthful,"All of us, who have represented people for years in the system get letters from prisioners um ... and their families. You know, this person is improperly convicted, you need to do something about it. But, its no one else's job to do it, other than  the inocence project ....  and they do it, they do itelse marvelously. ",100.0,a female,Showing no emotion,71,9,4.0,15.6,19.8,0.8,180.89,22.72,182.2,73.0,239.0,171.0,194.0,0.04388051630622415,0.000211072114455613,0.022604998765085038,0.022684663376886027,0.06781499629525511
trial_truth_003.mp4,1,0,0,0,0,0,1,0,0,0,1,0,0,1,0,0,0,1,1,0,0,0,1,0,0,0,0,0,0,0,0,0,1,0,0,0,0,0,1,truthful,"But yes, I was there. Yep, I stayed. Uh ... Yep, prob -- yes, yes.",6.92,a female,Showing no emotion,15,3,2.0,3.8,7.0,0.5,168.62,51.5,192.5,88.0,254.0,104.0,206.0,0.09002555303880547,0.00043412130994836286,0.04830028596859513,0.05019593429099116,0.14490085790578539
trial_truth_004.mp4,1,0,0,0,0,0,1,1,0,0,0,1,0,0,0,0,0,1,1,0,0,0,0,0,0,0,0,1,0,0,0,0,0,1,0,1,0,0,0,truthful,"I do. I was, uh... in the office, and I got a call ... uh, maybe ... close to nine o' clock, I don't remember, somewhere between eight and nine, from Rusty. He said, uh ... someone was just on the side of the house, and he was sort of not completely coherent, and said ... someone was, like, sleeping on the side of the house, and he called the police, and he was... oh and then he had to go really quickly to talk to the police, and then he ended up calling me back, and told me the whole story of what had happened, which was that, um... he had put Ian in the car as he does every day around that time, and Ian's car seat is on the right passenger side in the back, and as he walked around he smelled gas, um... as he walked -- 'cause he sort of exits the garage a little bit to get to his side of the car, he smelled gas, and, uh... our gas meter and pipe is on the side of the left side of the house if you're looking at the front. So he walked over to that spot, it's near our air conditioners,  and he said that there was a man lying face-down on the ground.",90.05,a female,Showing no emotion,256,20,3.0,55.9,78.0,0.7,173.56,42.97,188.4,80.0,266.0,178.0,200.0,0.07893620116119694,0.00037042906594117323,0.04246847073242907,0.04238563225390344,0.1274054121972872
trial_truth_005.mp4,0,0,0,1,0,0,1,0,0,1,0,1,0,0,0,0,1,0,1,0,0,0,0,0,0,0,0,0,0,0,0,1,0,1,0,1,0,0,0,truthful,"No, when Rusty backed up out of the garage ... So Rusty had a communication with him, but -- now I know why -- but Hemy never responded, because if he had spoken, I'm sure Rusty would have recognized who he was. So he stayed silent the entire time. And Rusty panicked. He got into the car, backed out of the driveway, and once he was at the end of the driveway picking up the phone to dial 911, Hemy ran across the lawn, over to a place that only someone who had been stalking my house for months would have known existed.",100.0,a female,Reading,135,10,4.0,26.3,34.8,0.8,199.55,42.58,202.3,76.0,332.0,185.0,223.0,0.07936210368985809,0.00034225241545091193,0.042449284058175774,0.044611039053255516,0.12734785217452732
trial_truth_006.mp4,0,0,0,1,0,0,1,1,0,0,0,1,0,0,0,0,0,1,1,0,0,0,0,0,1,0,0,0,0,0,0,0,0,0,1,0,0,0,0,truthful,"They really didn't tell me anything. They said there had been an accident. They said there had been an accident -- that Ian was fine, but there had been an accident. They didn't really tell me. And then I screamed into the phone asking what was going on, and I ... They just said you need to come here, so I dropped the phone and ran out of my office.",80.06,a female,Showing no emotion,66,8,3.0,13.1,22.9,0.6,177.56,40.67,186.3,78.0,282.0,175.0,197.0,0.07732128126470533,0.0003794129624996293,0.04330564667159514,0.04405021852164655,0.1299169400147854
trial_truth_007.mp4,1,0,0,0,0,0,1,0,0,1,0,1,0,0,0,0,1,0,1,0,0,0,0,0,0,0,0,0,0,0,0,1,1,0,0,0,1,0,0,truthful,"I have no idea. A police officer I presume. You'd have to ask my mother or my brother. Nope. They said they didn't know where he was being taken. Yep. Went to the house, I was in a fairly catatonic state, my dad and my brother started making phone calls to all the local hospitals, and they eventually got a hold of... I don't know, whatever the hospital is, Atlanta Medical Center. And they wouldn't tell my dad anything but that he was being taken there. So we got in the car, and we left. That's correct. Yes, he was and I had, I -- that was instructed that that was the best idea was to keep him at the day care. The, uh ... Donna. The woman that runs the day care. Yep. That's the safest place ... uh for him to be.",89.83,a female,Showing no emotion,209,23,3.0,39.0,60.7,0.6,182.4,35.92,186.6,72.0,294.0,176.0,200.0,0.07972456116721363,0.0003881098486301597,0.041655194020271874,0.04274661431957827,0.12496558206081562
trial_truth_008.mp4,1,0,0,0,0,0,1,0,1,0,0,1,0,0,0,0,1,0,1,0,0,0,0,0,0,0,0,1,0,0,0,0,0,1,0,0,1,0,0,truthful,"She was fine, laughing about simple little things I never once felt like there was anything wrong about the day, I felt like socially, the first time I saw her in a crowd, I thought she was much more comfortable one-on-one, that was the first time I noticed she was a little awkward in social areas and it didn't seem like she talked very much to other people, people would talk about that, it just wasn't the Jodi I knew cause one on one she was very talkative and insightful, very different",100.0,a Male,Reading,163,12,4.0,34.2,40.3,0.9,117.72,26.02,110.2,80.0,364.0,102.0,124.0,0.08131860082842808,0.0005919494113760654,0.04310867112411158,0.04901871029414306,0.12932601337233474
trial_truth_009.mp4,0,1,0,0,1,0,0,1,0,0,0,1,0,0,0,0,1,0,0,1,0,0,0,0,0,0,0,1,0,0,0,0,0,1,0,1,0,0,0,truthful,"I mean, it pops right upon the screen if you got you gmail open. and so somebody says, you know, hi, pops right up and, you can reply and you can also carry on the conversation while you are doing other things. But I mean it’s kind of like a text message back and forth that’s immediate you both responding right away. And sometimes you are even responding the things that 2 or 3 questions away, you know.",100.0,a Male,Showing no emotion,106,3,5.0,21.2,22.6,0.9,108.79,17.25,103.7,76.0,285.0,99.0,114.0,0.08633327913433275,0.0006755249794039806,0.04563574314798278,0.05097295338404755,0.13690722944394834
trial_truth_010.mp4,1,0,0,0,0,0,1,0,1,0,0,0,1,0,0,0,1,0,0,1,0,0,0,0,0,0,0,1,0,0,0,0,1,0,0,0,0,0,1,truthful,"yeah. I, maybe three months in the business, I was struggling, not doing so well. I was even thinking about quitting. And then at some point Alexander was flown into town as a guest speaker for solid city market. And I attended that training and I was inspired by him. It kind of changed my business around. And that was the only encounter with him personally. And so I just, I kept going and did much better after that.",95.0,a Male,Showing no emotion,133,11,4.0,30.3,37.0,0.8,110.2,17.34,106.8,76.0,293.0,100.0,116.0,0.07826652527362184,0.0006094259905252057,0.0404762244688438,0.04501542331159414,0.1214286734065314
trial_truth_011.mp4,0,1,0,0,0,0,1,0,1,0,0,0,1,0,0,0,1,0,1,0,0,0,0,0,0,0,0,1,0,0,0,0,1,0,0,0,0,0,1,truthful,"We talked about the same kind of books we liked to read, I mean, Atlas Shrugged, Thinking Girl Rich, How to Win Friends and Influence People, we had a lot of the same interests, she was a great conversationalist on the phone, we just had a lot in common, when I first met her, she's a business woman at a national convention, an entrepreneur, so I thought that was an attractive traits, all those things, it sounded like somebody I wanted to get to know",100.0,a Male,Showing no emotion,152,5,5.0,30.4,33.4,0.9,109.73,20.32,105.0,78.0,338.0,99.0,113.0,0.08357813304635293,0.0006666740467085467,0.04443394989707344,0.05006937352121058,0.1333018496912203
trial_truth_012.mp4,1,0,0,0,0,0,1,0,1,0,0,0,1,0,0,0,1,0,1,0,0,0,0,0,0,0,0,0,0,0,0,1,0,1,0,1,0,0,0,truthful,"I don’t think too often, cause usually we just call each other. We would be texting. If we are both by a computer when you are on gmail, you can kind of see your contacts and who’s actually online. And I think at one point, she wrote ‘hi this is the text’, and I was online and I responded back to him that we started kind of just talking that way ",100.0,a Male,Showing no emotion,99,6,4.0,18.0,22.2,0.8,111.65,29.61,106.6,80.0,295.0,99.0,113.0,0.08248262544002787,0.0005795891241678115,0.04322638631851703,0.04937690256350288,0.1296791589555511
trial_truth_013.mp4,0,1,0,0,0,0,1,1,0,0,0,1,0,0,0,0,1,0,1,0,0,0,0,0,0,0,0,1,0,0,0,0,0,0,1,0,0,0,0,truthful,I was under the assumption that it’s long time ago. I didn’t know if it was six months ago or two years ago. I really didn’t know. And yeah I didn’t try to pry too much in that relationship. But I felt like it was ... just ... yeah I didn’t know how long it was.,90.06,a Male,Reading,59,5,3.0,13.6,17.9,0.8,114.08,35.21,103.9,80.0,292.0,96.0,120.0,0.08976678777489489,0.0006388559843572132,0.04813491943185572,0.054578260934247,0.14440475829556718
trial_truth_014.mp4,1,0,0,0,1,0,0,0,1,0,0,0,0,0,0,1,1,0,1,0,0,0,0,0,0,0,0,0,0,0,0,1,1,0,0,0,0,0,1,truthful,from conversations ... from what Jodi telling me that he had talked to other girls even when they were supposed to be together. That might be what I mean.,90.0,a Male,Showing no emotion,43,2,3.0,9.4,12.7,0.7,111.86,28.66,105.1,81.0,265.0,99.0,114.0,0.08315176063942828,0.0005126064401671106,0.04340279976008056,0.05169949021105434,0.1302083992802417
trial_truth_015.mp4,0,1,0,0,0,0,1,0,1,0,0,1,0,0,0,0,1,0,1,0,0,0,0,0,0,0,0,1,0,0,0,0,1,0,0,0,0,0,1,truthful,"just talked to everybody, you know, you know he was flirtatious, I mean he, ah, you know, um, I don't know ... I don’t know who told me that. I don’t know enough about it. I just knew he was a flirt and that ... You know, he was ...  I remember Clancy telling me, you know, at times, you know, he was just him. You know, he would just flirt with everybody, just goofing around. Nobody really took it seriously.",100.0,a Male,Reading,117,10,4.0,24.9,33.0,0.8,120.49,25.6,116.5,78.0,375.0,109.0,126.0,0.08007939467688648,0.0005297113167157591,0.04204884329974253,0.04609141678227579,0.1261465298992276
trial_truth_016.mp4,0,0,0,1,0,1,0,1,0,0,0,1,0,0,0,0,1,0,1,0,0,0,0,0,0,0,0,1,0,0,0,0,1,0,0,0,0,0,1,truthful,Three friends of the deceased who were standing right next to him testified and said ... this is not the guy who shot our best friend. ,100.0,a female,Reading,28,2,4.0,5.9,7.5,0.8,197.81,53.56,193.6,87.0,318.0,156.0,243.0,0.06987697106773032,0.00030786575574664934,0.03526188647169827,0.03754749615324945,0.10578565941509481
trial_truth_017.mp4,0,0,0,1,0,1,0,1,0,0,0,1,0,0,0,0,1,0,1,0,0,0,1,0,0,0,0,0,0,0,0,0,1,0,0,0,0,1,0,truthful,And I am gonna go forward with this ... because I know I had nothing to do with this crime.,80.03,a Male,speaking passionately,13,1,3.0,2.6,4.5,0.6,145.07,23.38,142.1,90.0,212.0,131.0,160.0,0.06463537962412774,0.0003880413473699068,0.033010572436791306,0.0347660557184766,0.09903171731037391
trial_truth_018.mp4,1,0,0,0,1,0,0,0,1,0,0,1,0,0,0,0,1,0,1,0,0,0,0,0,1,0,0,0,0,0,0,0,0,0,1,0,0,0,0,truthful,"So I answered the questions as much as I could. What I knew, but I knew nothing about those murder and rape.",60.0,a Male,Showing no emotion,16,2,2.0,4.5,7.0,0.6,112.61,16.58,109.5,85.0,199.0,104.0,116.0,0.0781764637040344,0.0005851685802353387,0.04095775894324138,0.04063464191434221,0.12287327682972413
